Id,Title,PublishDate,Abstract
0,Security in Microservices Architectures,2021, a microservice is a small or even micro independent process that communicates acts and returns via messages through lightweight mechanisms like thrift http or restapi microservices architecture is amateur evolution of the monolithic architecture observing it in a functional way it is correct to claim that it breaks down complex applications into a simpler abstraction as this research demonstrates microservices architecture is intrinsically connected as a symbiosis with container based deployment because these containers have no need for embedded operating systems and calls are made for os resources via an application programming interface it is safe to claim that this technology is currently the focus of modern developers nowadays semantically speaking microservices functionally deconstruct larger applications into smaller discrete services and containers are viewed as a natural compute platform for this architecture a single service is and can be represented by multiple containers in a microservices cluster each single service is designed to provide a specific set of functions while services act to makeup the entire application it common in large application the decomposition into multiple arms of more than twenty services although less can be commonly found as well the main objective of microservices architecture is to disassemble the core components of a given type of application this study could be done in multiple ways all of them different because practically everybody has their specific way of looking at microservices but one aspect is the same cross mentalities security so the focus of this research is to expose the main security aspects of this specific architecture in this cost effective era 
1,Detecting Cyber Security Attacks against a Microservices Application using Distributed Tracing,2021, microservices are emerging as the dominant software design architecture for many different applications and cyber attacks are targeting more software organisations every day newer techniques for detecting cyber intrusions against such applications are in high demand application functionality that is executed within a microservices application can be monitored and logged using distributed tracing distributed tracing is normally used for performance management of microservices applications in this paper we used distributed tracing for detecting cyber security attacks each microservice call or sequence of calls executed in response to a request by an end user of the application is logged as a trace anomaly detection is a means of detecting irregular or unusual events or patterns in a data set that occur to a greater or a lesser degree than the majority of the data in this paper we present initial work that identifies anomalous distributions of traces a frequency distribution of traces is obtained from normal data and traffic is identified as an anomaly candidate if it differs sufficiently from the base distribution this approach is evaluated using a password guessing attack in addition we briefly discuss a nosql injection attack which we argue is difficult to detect using trace data 
2,Robust Failure Diagnosis of Microservice System through Multimodal Data,2023, automatic failure diagnosis is crucial for large microservice systems currently most failure diagnosis methods rely solely on single modal data in this study we conduct an empirical study using real world failure cases to show that combining these sources of data leads to a more accurate diagnosis however effectively representing this data and addressing imbalanced failures remain a challenge to tackle these issues we introduce diagfusion a robust failure diagnosis approach that uses multimodal data it leverages embedding techniques and data augmentation to represent the multimodal data of service instances combines deployment data and traces to build a dependency graph and uses a graph neural network to localize the root cause instance and determine the failure type our evaluations using real world datasets show that diagfusion outperforms existing methods in terms of root cause instance localization and failure type determination 
3,eZTrust: Network-Independent Zero-Trust Perimeterization for Microservices,2019, emerging microservices based workloads introduce new security risks in today data centers as attacks can propagate laterally within the data center relatively easily by exploiting cross service dependencies as countermeasures for such attacks traditional perimeterization approaches such as network endpoint based access control do not fare well in highly dynamic microservices environments in this paper we propose eztrust anetwork independent perimeterization approach for microservices eztrust allows data center tenants to express access control policies based on fine grained workload identities and enables data center operators to enforce such policies reliably and efficiently in a purely network independent fashion to this end we leverage ebpf the extended berkeley packet filter to trace authentic workload identities and apply per packet tagging and verification we demonstrate the feasibility of our approach through extensive evaluation of our proof of concept prototype implementation we find that when comparable policies are enforced eztrust incurs times lower packet latency and times lower cpu overhead than traditional perimeterization schemes 
4,Identifying Availability Tactics to Support Security Architectural Design of Microservice-based Systems,2019, microservices is an architectural style that considers systems as modular customer centric independent and scalable suite of services in order to address security requirements in microservices based systems architects often must focus on critical quality attributes such as availability aiming at employing architectural solutions that provide design decisions that address key security concerns although current architectural tactics for availability offer an extensive catalog of alternatives to improve availability and security factors new availability concerns demand new or improved architectural tactics in this article we examined the source code and documentation of open source microservices based systems identified uses of availability tactics and characterized them using anewly introduced descriptive template we found that almost all tactics did focus on preventing faults rather than detecting mitigating or recovering from them this approach can be further used to systematically identify and characterize architectural tactics in existing microservices based systems in other critical quality attributes concerning security such as confidentiality and integrity 
5,A Game of Microservices: Automated Intrusion Response,2023, the microservice architecture is a subtype of distributed systems that has been attracting a lot of interest both in the industry and academia emerging research recognizes the need for a better understanding of microservice security and in particular mechanisms that enable defense in depth and adaptive security with the continuously growing number of possible attacks and defenses the choice in the optimal defense strategy becomes non trivial as well as time critical we propose a cost sensitive adaptable intrusion response system for microservices which uses a game theoretic approach to automatically respond to network attacks in real time furthermore we discuss both the applicable attacks and defense responses specific to microservices 
6,Security Considerations for Microservice Architectures,2019, security is an important and difficult topic in today complex computer systems cloud based systems adopting microservice architectures complicate that analysis by introducing additional layers in the test system analyzed base layers are combined into three groups and possible security risks introduced by technologies used in these layers are analyzed the application layer focuses on security concerns that concern authorization and authentication the analysis is based on a microservice based rewritten version of the seat reservation system of the deutsche bahn using technologies such as amazon web services docker and kubernetes the comparison concludes that the security of communication in the test system could be significantly improved with little effort if security is not considered as an integral part from the beginning of a project it can easily be neglected and be expensive to add later on 
7,All Eyes on You: Distributed Multi-Dimensional IoT Microservice Anomaly Detection,2018, the internet of things is a distributed system of cooperating microservices iot services manage devices that monitor and control their environments the interaction of the iot with the physical environment creates strong security privacy and safety implications it makes providing adequate security for iot ss essential however the complexity of iot services makes detecting anomalous behavior difficult we present a machine learning based approach for modeling iot service behavior by only observing inter service communication our algorithm continuously learns s models on distributed iot nodes within an iot site combining the learned models within and in between iot sites converges our s models within short time sharing the resulting stable models among compute nodes enables good anomaly detection as one application firewalling iot ss becomes possible combining our autonomous s modeling with firewalling enables retrofitting security to existing iot installations we enable retrofitting access control to existing non secure iot installations our proposed approach is resource efficient matching the requirements of the iot to evaluate the quality of our proposed algorithm we show its behavior for a set of common iot attacks we evaluate how domain knowledge enables us to decorrelate events on anode and how adding context features improves the detection rate 
8,A Subgrid-Oriented Privacy-Preserving Microservice Framework Based on Deep Neural Network for False Data Injection Attack Detection in Smart Grids,2021, false data injection attacks have recently become a major threat to smart grids most of the existing fdia detection methods have focused on modeling the temporal relationship of time series measurement data but have paid less attention to the spatial relationship between bus line measurement data and have failed to consider the relationship between subgrids to address these issues in this article we propose a subgrid oriented microservice framework by integrating a well designed spatialtemporal neural network for fdia detection in ac model power systems first a well designed neural network is developed to model the spatial temporal relationship of bus line measurements for subgrids a microservice based supervising network is then proposed for integrating the representation features obtained from subgrids for the collaborative detection of fdias to evaluate the proposed framework three types of fdia datasets are generated based on a public benchmark power gridcase studies on the fdia datasets show that our method outperforms state of the art methods for fdia detection in these datasets 
9,Attribute-Based Access Control in Service Mesh,2019, cloud applications can consist of hundreds of services with thousands of instances in order to solve the problems of interservice interaction in this highly dynamic environment an additional software infrastructure layer called service mesh is introduced this layer provides a single point of interaction with the network for each service service mesh mechanisms are responsible for load balancing processing of network requests service discovery authentication authorization etc however the following questions arise complex key management fine grained access control at the application level confidentiality of data and many to many communications it is possible to solve these problems with attribute based encryption methods this paper presents an abstract model of a service mesh and a protocol for interservice communications which uses abe for authorization and confidentiality of the messages 
10,Automated Security Analysis for Microservice Architecture,2020, designing a software system that applied the microservice architecture style is a challenging task as its characteristics are vulnerable to various security attacks software architect therefore needs to pinpoint the security flaws in the design before the implementation can proceed this task is error prone as it requires manual analysis on the design model to identify security threats and trace possible attack scenariosthis paper presents an automated security analysis approach for microservice architecture our approach can automatically identify security threats according to a collection of formally defined security characteristics and provide an insightful result that demonstrates how the attack scenarios may happen a collection of formally defined security characteristics can be extended to support other security characteristics not addressed in this paper 
11,Building Secure Environments for Microservices,2022, microservice based architectures are widely used in modern software and the number of cyber attacks on software is increasing it is essential to make microservices more reliable and resilient against cyber attacks in this paper we propose a methodology to detect configurations of computing systems that host microservices and containers evaluate cyber risks of their essential components in an automatic continuous mode and reconfigure environments aiming to make them less vulnerable against cyber attacks our solution supports multiple operating systems and hardware configurations for cyber risk evaluationour approach relies on a public database of common vulnerabilities and exposures for software and hardware as well as penetration testing and static analysis furthermore the cyber risk evaluation model considers the attributes of microservicessuch as their privilege level we will show least and most vulnerable configurations for computing systems that use popular operating systems and applications 
12,Applying Spring Security Framework and OAuth2 To Protect Microservice Architecture API,2019, since microservice architecture has been widely applied and deployed by big companies such as google netflix and twitter this is a way of architecting software systems in which the services of a single application are decomposed then deployed and executed separately this research examines the possibility of applying spring security framework and oauth to secure microservice apis which are built on top of spring framework by developing a proof of concept of an inventory management system using msa on top of spring framework spring security framework and oauth we have conducted security tests over the poc using unit testing and manual testing techniques to examine if there are any vulnerabilities and we were able to show and confirm the effectiveness of the spring security framework and oauth in securing spring based apis key words software architecture microservice architecture oauth spring framework and poc 
13,Component-Based Refinement and Verification of Information-Flow Security Policies for Cyber-Physical Microservice Architectures,2019, since cyber physical systems are inherently vulnerable to information leaks software architects need to reason about security policies to define desired and undesired information flow through a system the microservice architectural style requires the architects to refine a macro level security policy into micro level policies for individual microservices however when policies are refined in an ill formed way information leaks can emerge on composition of microservices related approaches to prevent such leaks do not take into account characteristics of cyber physical systems like real time behavior or message passing communication in this paper we enable the refinement and verification of information flow security policies for cyber physical microservice architectures we provide architects with a set of well formedness rules for refining a macro level policy in a way that enforces its security restrictions based on the resulting micro level policies we present a verification technique to check if the real time message passing of microservices is secure in combination our contributions prevent information leaks from emerging on composition we evaluate the accuracy of our approach using an extension of the cocome case study 
14,ConfigRand: A Moving Target Defense Framework against the Shared Kernel Information Leakages for Container-based Cloud,2021, lightweight virtualization represented by container technology provides a virtual environment for cloud services with more flexibility and efficiency due to the kernel sharing property however the shared kernel also means that the system isolation mechanisms are incomplete attackers can scan the shared system configuration files to explore vulnerabilities for launching attacks previous works mainly eliminate the problem by fixing operating systems or using access control policiesbut these methods require significant modifications and cannot meet the security needs of individual containers accurately in this paper we present configrand a moving target defense framework to prevent the information leakages due to the shared kernel in the container based cloud the configrand deploys deceptive system configurations for each container bounding the scan of attackers aimed at the shared kernel in design ofconfigrand we propose a framework applying the moving target defense philosophy to periodically generate distribute and deploy the deceptive system configurations in the container based cloud establish a model to formalize these configurations and quantify their heterogeneity present a configuration movement strategy to evaluate and optimize the variation of configurations the results show that configrand can effectively prevent the information leakages due to the shared kernel and apply to typical container applications with minimal system modification and performance degradation 
15,The 5G-EPICENTRE Approach for Decreasing Attack Surface on Cross-Testbeds Cloud-native 5G Scenarios,2021, the g epicentre eu funded project proposes mission critical service and application experimentation in federation adopting a testbed of testbeds approach in which different g based platforms are intelligently combined and calibrated from a single control point this cross testbed concept embraced in the g epicentre project together with the transition of g technologies into a cloud native environment pose numerous challenges including an increased attack surface and various security concerns such as how to enforce security policies at multiple levels across the entire infrastructure in that sense first this paper provides an overview of such security challenges and a review of the methodologies discussed in the literature to decrease the attack surface in those complex scenarios later this paper presents the g epicentre security approach and an early version of a security framework which considers the usage of security by design techniques network and container level isolation strategies and the usage of the service mesh design pattern all of them key elements to allow to secure the overall infrastructure and monitor mitigate and respond to security incidents 
16,FirecREST: a RESTful API to HPC systems,2020, as science gateways are becoming an increasingly popular digital interface for scientific communities it is important for high performance computing centers to provide a modern and externally accessible interface such as web enabled apis such an interface provides access to hpc center resources to allow scientific web portals to submit a job or move data in and out the hpc center this work presents the firecrest api a restful web api infrastructure that allows scientific communities to access the various integrated resources and services available on hpc systems the capabilities of firecrest have been defined based on the use case requirements described in this work 
17,Evaluation of security threats in microservice architectures,2022, i abstract the microservice architecture is a popular architectural pattern in the industry to implement large systems as they can reduce the code bases of each service and increase the maintainability for each of the individual services by dividing the application into smaller components based on business logic the services can be implemented in different programming languages and communicates over anetwork as a consequence it might lead to a greater attack surface for an adversary of the system in order to ease the implementation of microservice architectures a set of design patterns exists two patterns addressing the security of the architecture are the api gateway pattern and the sidecar pattern more research is needed in order to identify the security threats microservice architecture encounters and how the design pattern handles those this master thesis uses threat modeling withattack graphs along withattack simulations in order to investigate the threats in microservice architectures and how they compare between the design patterns to construct the attack graphs and perform the attack simulations securicad along with corelang was used on a microservice architecture with each of the design patterns the report concludes that the sidecar pattern is faced with less risk than the api gateway pattern overall and presents a set of suggestions regarding how the security can be improved in microservice architectures 
18,Graph-based IoT microservice security,2018, the internet of things can be considered as service oriented architecture of microservices the ss inherently process data that affects the privacy safety and security of its users iot service security is a key challenge most state of the art providing iot systemsecurity is policy basedwe showcase a graph based access control that runs as module on iot nodes or in the network our solution intercepts and firewalls inter service communication it automatically creates a model of legitimate communication relationships the model is interactively updated via a simple to understand interface our solution adds inevitable iot security to existing iot systems 
19,Securing Microservices Against Password Guess Attacks using Hardware Performance Counters,2022, modern customer facing applications need to be easy to use localizable and to scale out to serve large customer bases microservice architectures have the potential to decentralize functionality improve flexibility and provide faster time to market of incremental changes however applications implemented as microservices also have a larger surface area which may make them more prone to cyber attacks modern operating systems provide performance counters which are tamper resistant and can be used to track the runtime behavior of applications in this work we aim to detect a password guess attack on microservice using performance counter data our approach consists of modeling behavior of normal and attack user login requests identification of key performance counters that effectively distinguish these requests and developing a machine learning model that classifies unknown login requests a fully connected neural network based classification model gave us better test accuracy in detecting the attacks 
20,HT-RBAC: A Design of Role-based Access Control Model for Microservice Security Manager,2021, for transitioning to a decentralized system a microservices platform has become popular in today software development due to its light weight mechanisms however increasing the number of services results in a challenge to maintain the security of access control the more attack surfaces can bring security and privacy risk via sensitive data therefore a chain of trust domains was introduced to solve this problem the extended role based access control model for microservice security managers is proposed for leveraging threats of unauthorized access to sensitive information and identity verification across all environments in application container solutions this paper proposes using an ht rbac to authenticate authorize and identify user access control via api gateway a prototype system integrated with oauth authentication server is implemented for empirical study the results report that the approach provides faster and more flexible access to information in addition to improving incident response time 
